id,theme,sujet,angle,formats,status,date_cible
001,sante,Système de santé québécois,Pourquoi le Québec attend plus longtemps que partout — et qui en profite,tiktok;reels;carrousel;youtube,en_recherche,2026-04-01
002,crimes_canada,Crimes du Canada – pensionnats autochtones,Ce que le Canada a fait et n'a toujours pas réparé — faits et chiffres,youtube;thread_x;carrousel,en_recherche,2026-04-15
003,independance,Indépendance maintenant,L'indépendance en 2026 : argument économique concret pour les sceptiques,tiktok;youtube;thread_linkedin,brouillon,2026-05-01
004,energie,Hydro-Québec – Crise de capacité et exportations,On exporte notre énergie aux Américains pendant qu'on frôle les pannes,tiktok;carrousel;youtube;thread_x,en_recherche,2026-03-28
005,culture,Culture québécoise – accessibilité diffusion et reconnaissance,Nos artistes survivent malgré le système — pas grâce à lui,tiktok;carrousel;youtube;thread_x,en_recherche,2026-04-07
